{
  "schema": "cloudig/identity-settings/1.0.0",
  "edited_at": "2026-09-11T09:00:00Z",
  "subject": "01993520-0000-7000-8000-000000000001",
  "assistant": "01993520-0000-7000-8000-000000000002",
  "apply_assistant_to_all": false,
  "platforms": {
    "chatgpt": "01993520-0000-7000-8000-000000000011",
    "deepseek": "01993520-0000-7000-8000-000000000012",
    "gemini": "01993520-0000-7000-8000-000000000013",
    "grok": "01993520-0000-7000-8000-000000000014",
    "doubao": "01993520-0000-7000-8000-000000000015",
    "kimi": "01993520-0000-7000-8000-000000000016",
    "qwen": "01993520-0000-7000-8000-000000000017",
    "chatglm": "01993520-0000-7000-8000-000000000018",
    "zai": "01993520-0000-7000-8000-000000000019",
    "yuanbao": "01993520-0000-7000-8000-000000000020",
    "mistral": "01993520-0000-7000-8000-000000000021",
    "claude": "01993520-0000-7000-8000-000000000022"
  }
}
